{
  "$schema": "./profile.schema.json",
  "label": "Implement",
  "description": "Writable implementation with verification",
  "instructions": [
    "profile/implementation",
    "profile/concise"
  ],
  "skills": [
    "*"
  ],
  "adapters": {
    "pi": {
      "model": {
        "provider": "openai-codex",
        "id": "gpt-5.5"
      }
    },
    "codex": {
      "sandbox": "workspace-write",
      "approval": "on-request",
      "model": {
        "id": "gpt-5.6-terra",
        "thinking": "medium"
      }
    }
  }
}
