{
  "$schema": "./profile.schema.json",
  "label": "Review",
  "description": "Read-only evidence-based code review",
  "instructions": [
    "profile/read-only",
    "profile/review",
    "profile/concise"
  ],
  "skills": [
    "ponytail",
    "self-explanatory-code"
  ],
  "adapters": {
    "pi": {
      "tools": [
        "read",
        "grep",
        "find",
        "ls"
      ],
      "extensions": [
        "harness-manager"
      ],
      "mcps": [],
      "model": {
        "provider": "openai-codex",
        "id": "gpt-5.5"
      }
    },
    "codex": {
      "sandbox": "read-only",
      "approval": "never",
      "model": {
        "id": "gpt-5.6-terra",
        "thinking": "high"
      }
    }
  }
}
