{
  "$schema": "./profile.schema.json",
  "label": "Research",
  "description": "Evidence-oriented web and knowledge-space exploration",
  "instructions": [
    "profile/read-only",
    "profile/research",
    "profile/model-standard",
    "profile/concise"
  ],
  "skills": [
    "agent-browser",
    "lark-base",
    "lark-doc",
    "lark-drive",
    "lark-sheets",
    "lark-wiki"
  ],
  "adapters": {
    "pi": {
      "tools": [
        "read",
        "bash",
        "grep",
        "find",
        "ls"
      ],
      "extensions": [
        "harness-manager"
      ],
      "mcps": [],
      "model": {
        "provider": "openai-codex",
        "id": "gpt-5.5"
      }
    },
    "codex": {
      "sandbox": "read-only",
      "approval": "never",
      "model": {
        "id": "gpt-5.6-terra",
        "thinking": "medium"
      }
    }
  }
}
